,Assessments_Primary_Problem,Report_1_Narrative,Report_2_Narrative
1467720,chartorpublication,IAH recently published several new RNAV approaches. All of the RNAV (RNP) approaches in IAH have the phonetic alphabet 'Y' in the title. At other airports that have RNAV (RNP) approaches the letter 'Z' is in the title. So at most airports we are cleared for RNAV (RNP) Z RWY XX approach. At Houston we are cleared for RNAV (RNP) Y RWY XX approaches. At the other airports; the RNAV Y approaches have (GPS) in the title of the approach- RNAV (GPS) Y RWY XX. RNP and GPS approaches have a slightly different FMC box programming protocol. Not sure if the IAH approaches were coded wrong; but it would be nice to have a consistent naming protocol when using RNAV (RNP).,
1468249,chartorpublication,Aircraft X was taxiing out of an FBO ramp and made a left turn to cross the active runway after being told to taxi across the non-active runway. I was looking at a strip while giving a clearance to a different aircraft on frequency while Aircraft X crossed runway 28 hold short lines. He was noticed by the local control trainee at the time and he asked me what he was doing. At the moment I told Aircraft X to stop! The aircraft stopped and unfortunately Aircraft Y was on takeoff roll [and] was forced to abort takeoff. This is a known hot spot on the airport and is depicted on the airport diagram in the AFD. This has been an ongoing problem for years at our airport and our local safety counsel has brought it up numerous times that there needs to be better signage and better markings on the pavement.,I was training on LC.  Aircraft Y called up for VFR departure and cleared him for takeoff from Runway 28.  As Aircraft Y was approaching Taxiway A4; on takeoff roll; I scanned and saw an aircraft crossing the hold short for Runway 28 at Taxiway A3 (Aircraft X). I said 'What is that guy doing' to GC and immediately told Aircraft Y to hold position and then to cancel takeoff clearance.  Aircraft Y was able to come to a stop before Taxiway A3 and Ground Control had stopped Aircraft X.  Both aircraft were taxied out to Runway 28 and took off with no further incident or assistance needed.Recommendation: The intersection of Taxiway A3 and Runway 28 is a known hotspot.  This is a frequent occurrence that a pilot will get confused and think they're about to cross Runway 31 on Taxiway A. Something should be done to address this intersection to help the confusion.  Better signage and more clearly marked pavement is recommended.
1470009,chartorpublication,Briefed approach; landing and taxi in [using] JeppFD pro and being a frequent flyer into SKBO there were no changes. Typical landing rollout on 13R [and] I followed the new high speed turnoff lights and found ourselves on a taxiway that was not on the 10-9 page. When we checked in with Ground they gave us taxi directions that did not correlate with the signage or FD pro. I assume the changes have not be forwarded to Jeppesen. Please coordinate and update the 10-9 pages ASAP.,
1472080,chartorpublication,We were proceeding from TREMO to KIPPR waypoint when ATC asked where we were going. We said KIPPR. He said he did not show that on our flight plan; then cleared us direct to USIRE. Upon further review; we made a mistake. The waypoint on our flight plan we were supposed to be going to was KIMMR. The two points are not far from each other and basically we weren't terribly far off course; but off course we were. Unsure what caused it. Clearly we made a mistake. KIPPR and KIMMR are similar enough that during waypoint check I didn't speak clearly enough and/or the First Officer misheard. Either way; we both missed it. We already have procedures in place to prevent this so I don't have any new suggestions.,
1473256,chartorpublication,Upon arrival; our gate was occupied and Tower told us to hold in the Lima Pad. Using the 10-9; I did my best to find and park as designated on that page. Later; the Ground Controller queried us on our parking location and we discussed the location versus what is depicted on the 10-9 page. He said others have done the same thing.The STL 10-9 page has an incorrect location for the Lima Pad. The 10-9D Low Vis page appears to have the correct location. The 10-9B Parking gates page would be a great place to put a more detailed location schematic for the Lima Pad.,
1477589,chartorpublication,New crane (over 100 ft tall) installed at Texas Tech University Health Sciences Center at 3601 4th Street Lubbock; TX in late July. Crane is approximately 120 ft tall and has a single warning light on top of mast. Boom is over 100 ft long and does not have a light on either end. As it stands right now; the boom is closer to the University Medical Center (602 Indiana Ave Lubbock; TX) Emergency Room Helipad than any of the well-marked buildings.This appears to be a potential problem. With multiple helicopters using pad at all hours of the day and night; approaching from several directions; this movable boom could be struck by an incoming or outgoing flight very easily; especially at night.,
1477924,chartorpublication,I have been flying to MGGT for many years and I love it. The country; the people; the food. However; the flying environment is very demanding and the controllers add to that stress.1. On approach the night before; we were just 13 miles from the final approach fix when he asked us to speed up to 250 kts. We respectfully declined and he was good with it.2. Every time we call for departure clearance; he always gives us a different SID than we filed. So; we asked for the filed SID he gave it to us. It is the same every trip.Ok; these two points are minor; but I wanted to mention them. However; the next three points are very important and need to be addressed.3. Holding short for runway 02; he said; 'Aircraft X; you are cleared immediate takeoff. Fly runway heading and maintain 8;000 feet until 10 DME.' And that is all he said. I looked at my FO and his mouth dropped open and he shook his head. He looked at me as I was also now shaking my head and then I keyed the mike and said 'we are not going to fly runway heading and maintain 8;000 feet.' He backed off and said; 'OK; OK hold short.' 4. We did a bleeds off takeoff at 159;000 pounds. My first officer did the takeoff. I asked him to run the power up to max and make it shake before releasing the brakes. Everything seemed OK but with slow acceleration because of the altitude and weight. During the roll it became evident that we were far down the runway when the V1 call came and I made the 'rotate' call right after that. The FO rotated and I said 'look how far down we are' and it appeared to be about only about 2;000 feet left. The aircraft did not jump off the runway and it slowly lifted off and climbed after what seemed like a little hesitation. After we cleaned up the aircraft; we discussed it and the FO said that 'the controls seemed sluggish at rotation.' We both discussed that if we had lost an engine; it would have been very; very bad. We double checked what we did with flaps; N1; TPS; etc; but we think it was all correct. Then I thought about it and we had asked about the wind right at taxi about 20 minutes earlier. He had said calm. I did not ask for an updated wind on takeoff and he did not offer a wind readout. I suspect that we had a 5 to 7 knot tailwind on takeoff and he did not tell us. 5. Something is wrong with the design/geometry of RNAV (RNP) Y Rwy 20. The first time I flew it a couple of months ago at night in the weather I broke out at minimums and it seemed that I was screaming low right over the runway end identifier lights with 4 red PAPIs. Two days later I flew the same approach during the day down to minimums again. When we broke out I looked around and noticed that we seemed low with of course 4 red PAPIs again and really close to the buildings and antennas. I said to my FO 'Does it seem like we are a little low?' He right away loudly said 'We ARE LOW!' I said it's strange because everything looks perfect on the HUD. Later we went to Duty Free and talked with a guy from another airline who landed just before us. He said that his stepfather is a Captain and briefed him that everybody knows when you get to DA on this approach; hesitate for a couple of seconds and then continue visually. Well; the PAPI is 3.5 degrees and the approach is 3.2; so you never get up to the PAPI. However; it appears to many of us pilots that the approach takes you to land on the displaced threshold instead of the runway.,
1479665,chartorpublication,The NOTAM addressing an engine failure on takeoff from Runway 01C at IAD is creating a lot of confusion at best; and is being ignored by most crews (for somewhat valid reasons). In our case; fate intervened and we took off from Runway 30. First and foremost; why does this NOTAM only apply when Runway 01R is closed? Are the cranes moved when 01R is open? If Runway 01R is open (as was the case for us); should this procedure be followed or not? The NOTAM references a 'Flight Ops Bulletin'. What exactly is a 'Flight Ops Bulletin' (Our app contains Pilot Bulletins and Ops Alerts only)? Assuming this refers to a Pilot Bulletin; where is this mystery bulletin and how does one read it? The NOTAM states that all changes have been made in our flight planning software. As you can see below; this is simply not true. Lastly; previous crews have cited the B777 Flight Manual Note at the top of page and ignored this NOTAM. Please update IAD pilots as soon as possible. Thanks!,
1479997,chartorpublication,During flight planning; I noticed that the flight was planned on the standard routing which utilizes the ROZZE2 arrival commencing at the QUINZ intersection.  There was a NOTAM stating that the ROZZE2 was not applicable for that particular day. I called our Dispatcher and pointed out the NOTAM and requested different routing.  The Dispatcher agreed and produced a new flight plan.*Dispatcher and crew working together to make sure the flight was safe and legal.  The system worked.*  Additional info:This arrival was known to have an issue from the previous Jeppesen change.  The altitude restriction at QUINZ was incorrectly annotated on the Jeppesen page. If I recall correctly; for a while there was a NOTAM listing the correct altitude restriction while the arrival was still available.  On this day; the entire arrival was 'N/A'd'.This NOTAM was missed by the Dispatcher. He mentioned that there was a way for Dispatchers to let each other know about important issues like this; and said he would enter this NOTAM into that system.Recommend continued improvement of the NOTAM system to prioritize and highlight items affecting safety and legality of flight.  In this age of computers; a user friendly NOTAM system is way overdue.,
1484956,chartorpublication,We were given taxi to Runway 25R via bravo. As we taxied up to the full length 25R we were asked if we crossed taxiway foxtrot which I said yes and the tower controller came back saying we didn't get cleared to taxi full length. The flight continued normally after.Looking further into the taxi chart it does say we need tower clearance to cross foxtrot but the location of the description is above hangars and not in a good location for pilots unfamiliar with LAX operations.,
1485506,chartorpublication,We were being vectored for the ILS to runway 17R. While on a west downwind; on a heading of 320 degrees and at an altitude of 4900 feet; (1500 meters); we noticed we had not been given a turn after the last aircraft on final approach had already passed abeam us. We made a radio check with Shanghai approach to see if they had forgotten to turn us. We did not receive a response; so after one more attempt; we switched to the tower frequency posted on the approach plate (124.35) and attempted to call them. We did not receive a response from them either. After two more attempts we attempted contact with approach on 121.5 and for a frequency to contact approach. We were given 123.6 and immediately reestablished contact. We were given vectors to intercept the localizer and then cleared for the approach. When we were switched over to tower frequency; the frequency was different than 124.35; which is the frequency posted on the approach plate for the ILS to runway 17R. It might explain why we did not receive a response on that frequency when we attempted to contact them earlier. The flight proceeded without any further problems after re-establishing contact with Shanghai approach control.,
1487073,chartorpublication,I downloaded [EFB] JeppPro version 3.0.2. I had also completed the 'CQDL' for the new version prior to downloading. All seemed normal with the app although it appeared that on landing slowing through 80 KTS the taxi chart would automatically come in the AMM (Airport Moving Map) mode instead of the chart mode. Arriving in EWR on the 5th on flight ##### I noticed during the landing rollout that the taxi chart was in AMM mode and the screen was blank. I switched it to chart mode; which worked normally. I assumed it was just a glitch and forgot about it. The next night we landed in EWR again on flight ##### at night. The taxi chart again came up in AMM mode and the screen was blank. Now I was paying attention a bit more. After thinking about this for a day; I have some concerns.1.	It appears as though the taxi chart now defaults to the AMM mode on landing rollout. This default requires an action by the pilot at a critical time to get the info needed. I also find the AMM mode a little disorienting at this point; as I don't really know what I'm looking at. Again; a huge threat at a critical time in the flight.2.	Unfortunately; this chart has very little information (no frequencies; light information; runway lengths etc.) and does not meet the needs of a crew trying to ascertain their position immediately. It may be that in the future; the AMM chart will have the needed information but it is completely inadequate now.3.	The AMM chart on my iPad seems to work normally on other airports but not for EWR. This is obviously a major problem when it defaults to AMM.4.	There doesn't seem to be a choice in JeppPro settings for the pilot to select AMM or chart for the taxi chart. Why would this not be a pilot selectable setting?In conclusion; there are at least four threats here. The chart defaulting to a taxi chart with inadequate information; a chart we are unfamiliar with; apparent blanking at some airports (at least on my iPad); and the pilot having to fiddle with the iPad at a critical time during the landing roll.,
1487460,chartorpublication,After exiting 27R; Tower told us to enter at Spot 9 and contact the ramp. I referenced my 10-9 chart to verify my location and maintain my taxi situational awareness. My visual on the signage and subsequent reference to 10-9 didn't [match]. Specifically; signage indicated K-3; but K-3 isn't denoted on 10-9. Additionally; a comparison between 10-9 and 10-9B indicates that the charts show two different taxiway configurations in the area of K and K3; M; and L.,
1487855,chartorpublication,Found an error on the Jeppesen Chart for PSP [Tailored Company Page XX-0-2]. We were landing on RWY 31L as the sun was just slipping below the mountains to the west of the airport; it was VMC. With the shadows and the last bit of sunlight hitting us in the face; it was hard to see the edges for the runways. When landing RWY 31L at PSP; there is no ILS and no straight in approach because of the mountains to the east; so the RNAV Visual brings you in at an angle. The First Officer was flying and it was very easy to see the airport and the PAPIs to both runways. With the shadows from the setting sun; Taxiway C looked a lot like a runway; not a taxiway (in the past it was; in fact; used as a runway while work was being done to 31L). He started to line up on the taxiway; and [I] was easily able to direct him to the left to line up on 31L. He mentioned; however that he lined up on the taxiway because during the brief as he went through the Jeppesen chart; it said that there would be VASIs on the left; and he initially lined up to put the VASIs on his left; thus lining up on the taxiway. The PAPI's; actually; are on the right of 31L; not the left. It does say that correctly on page YY-21; page 10-9A; and page XX-04. The reason for the report is that we were easily able to correct at a safe altitude; but the First Officer did have a moment of confusion and the one page that he had up to help him; had the wrong information on it! Before someone actually does land on the taxiway; please have Jeppesen page XX-0-2 fixed to show that RWY 31L actually has a PAPI on the right; not a VASI on the left.,
1489030,chartorpublication,Upon landing my IPad jepp FD Pro defaults to the AMM (Aircraft Moving Map) taxi chart. It appears on rollout and pops up too small and taxiway markings are not readable and not even portrayed until you blow up the map. So if I am on a rollout and get a clearance to clear at a certain taxiway; I might not be able to find it especially at night in the rain. Most of the time I do not have a free hand to let go of the tiller and throttles and reach over to blow the chart up so that I could see it. I have tried turning it off to no avail. It is set as a default and will not change. I am finding this to be a dangerous distraction on the landing roll and runway exit.,
1489535,chartorpublication,On the WATSN3 arrival into ORD; the controller started issuing holding clearances since O'Hare had just 'lost a runway.' Just a few miles before we reached MKITA; the controller issued a clearance to hold as published.I looked at my chart and saw no published holding pattern at MKITA. I didn't think to scroll to the edge of the chart since HAUPO and HALIE both had patterns published on the course. We reached MKITA just a moment later and asked the controller for a vector since we didn't see a published pattern.The controller informed us the pattern was 'on page two of the chart.' Then; I zoomed out and saw the inset boxes on the left side of the chart. No ball note directs pilots to look elsewhere on these new charts! If there were no other published holds; I would have looked elsewhere. But; having some published on the course while others are in boxes is very confusing when a hold is suddenly issued at the last possible moment to join it.As we turned back towards the pattern; the pilot of another aircraft reported they were also unable to locate the published pattern.,
1490068,chartorpublication,We recently flew into SFO; and there appears to be an error in the taxiway designations and the depiction on the 10-9 airport diagram. The taxiway that is charted as 'B1' on the 10-9 page is actually labeled as 'Q' on the airport signs on the actual taxiway. We did not see any taxi sign labeled as B1.  Also; the taxiway labeled as 'Q1' on the 10-9 page; is not even marked on the actual taxiway in SFO. I could be mistaken; but I would like to request that this issue be looked into to make sure that the signage on the diagram exactly matches the actual taxiway signs on the airport.,
1490310,chartorpublication,Due to a runway and some taxiway closures we were instructed to back-taxi on the takeoff runway and execute a 180 and call tower when ready to takeoff. Looking at the Jeppesen airport (10-9) page it was not clear where to make the 180 turn. The Captain made the turn close to the approach end of [the] Runway and we began the takeoff roll. During the takeoff roll (somewhere near 80kts) we received an aural warning: 'Short Runway'. The actual runway length of [the] Runway is [shorter]. We knew that it was a shorter than normal runway; and that we had lost some runway due to the 180 maneuver. We elected not to reject the takeoff. The long runway was closed. Additional taxiway closures forced us to back-taxi into position. When we looked at the 10-9 page it was unclear that there was an area prior to the [Runway] threshold that we could have used to make the 180 turn and thus use all the available runway. This taxi circle was visible on the moving map portion of the application; but only if you were fully zoomed in. Even then; the red '[Runway]' icon was over the top of this taxi circle obstructing it from view. Also; there was some language barrier as the ground and tower controllers were not easy to understand. I had to ask them to repeat the taxi instructions more slowly so they could be understood better.  [Suggest] first; fix the 10-9 Jeppesen page. It should be very clear where taxi lines are painted; especially if you have to do a maneuver that you seldom do. Tower or ground could have told us that there was an area prior to the threshold that we could have used to turn around more efficiently. We as a crew could have stopped what we were doing and asked more questions of ourselves and ground/tower controllers. Notes could be added to our company airport reference pages to point out this issue. ATIS could be more plain language than just taxi/runway closures; e.g.; 'Plan to back-taxi and execute a 180 turn prior to the runway threshold.' Crews could be trained better on the 180 maneuver (more frequently). Aerial or satellite photos of the area to be used to execute the 180 could be provided to crews.,
1494854,chartorpublication,Aircraft X inbound TVK and requested an RNAV Approach to Runway 16 due to IMC conditions. Aircraft X advised they had the current weather. Another sector informed me that the NOTAMs were read to the pilot. I reviewed the NOTAMs for the airport prior to issuing approach clearance. The NOTAMs at the time were PAPI OTS; RWY END LGTS OTS and one OBST LGT OTS. Aircraft X was cleared for RNAV approach and was instructed how to cancel IFR and frequency change was approved. Aircraft X cancelled IFR clearance in the air after breaking out of IMC. Shortly after; Aircraft X queried if I was still able to hear them. I replied I could. Aircraft X asked if there was a NOTAM for a runway or airport closure. I replied 'negative'.There were no NOTAMs for airport or runway closure at the airport. Aircraft X reported a lighted yellow X on the runway approach end and saw construction personnel and equipment on the runway. Aircraft X executed a go-around and circled the airport. Aircraft X requested IFR clearance to a nearby alternate airport and landed safely. I reported the incident to the CIC (Controller in Charge). I assumed the airport to be closed until I was told otherwise. I made a note of this at the sector and passed the information on to my relief. The next day; the NOTAMs showed the first and last 500 ft of the runway were closed.The runway and/or airport closure NOTAM was not displayed on at the time the approach clearance was issued. Either the NOTAM was not issued or valid at the time the approach clearance was issued or through some glitch; the NOTAM was not properly displayed at the sector. The status of runway and airport NOTAMs is critical to safety and should always be accurate.,
1496027,chartorpublication,The design of JeppFD-Pro has a built in problem on Displaying SIDs whereby a tool for rotating the display and highlighting on the display blocks the altitudes required by the SID from view without deliberate effort to search for it. The TERPZ 6 in BWI is a good example.  It is not a good and best practice to hide critical information on any navigation document with a tool that can be placed anywhere in existing space in the navigation and tool margins. I have come close in other cities to missing critical information hidden by that poorly placed tool. I cannot be the only one. JeppFD-Pro needs to resign the user interface to remove this tool from blocking information on charts and plates.,
1498044,chartorpublication,The Reno Special Operations 10-7B chart says:'During IMC operations to 16L and 16R; use the following guidance to ensure single engine climb capability in the event of an instrument missed approach commenced at decision height. This applies for all instrument approaches:SINGLE ENGINE GO-AROUND - Fly the published missed approach - Level off and clean up at 6200ft MSL - After clean up; continue climb at flaps up maneuvering speed'Having recently flown some -800 heavyweight single-engine go-arounds from decision height in the simulator; I have some concerns about the guidance in the second bullet above - 'level off and clean up at 6200ft MSL.' This procedure can put you very close to high terrain. Referencing perhaps the most commonly flown approach at Reno; the ILS Z or LOC Z Runway 16R Approach Plate 11-1; you'll notice that ZAKBI is the first fix on the missed approach procedure. It is roughly eight miles south of the center of the airport. ZAKBI is located nearly over; perhaps a couple thousand feet east; of a 6274 foot peak. This peak is depicted on the Reno ILS 34R 11-5 Approach Plate just south and west of step-down fix CALEG; and is likely the reason for the 6800ft restriction on that approach until passing CALEG. The issued guidance to level off and clean up at 6200ft MSL; 74ft below the highest terrain in close proximity to the missed approach flight path; presents an obvious safety concern. Perhaps the guidance on the Reno 10-7B concerning single engine go-around bullet two should be changed to read 'level off and clean up at 6800ft MSL.' This would provide at least 500ft clearance above the terrain near ZAKBI. It may also be wise to include a crossing restriction at ZAKBI of 'at or above 6800'' on the ILS Z 16R missed approach procedure and on any other chart ZAKBI is utilized. This restriction would be similar to the CALEG step down 6800ft restriction on the 34L Localizer Approach; and is appropriate given the two fixes are very close to one another. In the meantime I'd also suggest immediate guidance for crews to NOT level off below 6800ft on a single engine go-around in Reno.,
